doc_namecontent,path
first task,Yesterday I met John at Starbucks and we had a great conversation about his recent trip to New York City,/path/1
second task,The company's CEO Sarah Johnson announced a new product launch at the annual conference,/path/2
third task,After finishing her degree in Computer Science Mary decided to join Google as a software engineer,/path/3
fourth task,The Golden Gate Bridge is a suspension bridge spanning the Golden Gate strait in San Francisco California,/path/4
fifth task,My favorite band Radiohead is a British rock band formed in 1985,/path/5